{
  "$schema": "../schemas/light_time_pointing.schema.json",
  "target": {
    "id": "433",
    "id_type": "smallbody"
  },
  "observation": {
    "time_utc": "2026-07-30T12:00:00",
    "time_role": "receive"
  },
  "transmit_station": {
    "name": "Example monostatic radar",
    "longitude_deg": 116.0,
    "latitude_deg": 40.0,
    "height_m": 100.0
  },
  "ephemeris": {
    "earth": "builtin",
    "cache": true,
    "cache_directory": "tmp/astroquery_cache"
  },
  "solver": {
    "tolerance_s": 1e-7,
    "max_iterations": 20
  },
  "output_json": "outputs/light_time_pointing/solution.json"
}
